No.     Time           Source                Destination           Protocol Length Info
      1 0.000000       Cisco_82:0b:84        CDP/VTP/DTP/PAgP/UDLD CDP      365    Device ID: Router  Port ID: Ethernet0  

Frame 1: 365 bytes on wire (2920 bits), 365 bytes captured (2920 bits) on interface \Device\NPF_{286628B7-C690-4A38-B5BC-FA4478D21241}, id 0
IEEE 802.3 Ethernet 
Logical-Link Control
Cisco Discovery Protocol

No.     Time           Source                Destination           Protocol Length Info
      2 6.058209       30.30.30.1            30.30.30.6            TCP      66     58192 → 10000 [SYN] Seq=0 Win=64240 Len=0 MSS=1460 WS=256 SACK_PERM

Frame 2: 66 bytes on wire (528 bits), 66 bytes captured (528 bits) on interface \Device\NPF_{286628B7-C690-4A38-B5BC-FA4478D21241}, id 0
Ethernet II, Src: Cisco_82:0b:84 (00:10:7b:82:0b:84), Dst: RealtekS_68:23:8b (00:e0:4c:68:23:8b)
Internet Protocol Version 4, Src: 30.30.30.1, Dst: 30.30.30.6
    0100 .... = Version: 4
    .... 0101 = Header Length: 20 bytes (5)
    Differentiated Services Field: 0x00 (DSCP: CS0, ECN: Not-ECT)
    Total Length: 52
    Identification: 0x64ea (25834)
    010. .... = Flags: 0x2, Don't fragment
        0... .... = Reserved bit: Not set
        .1.. .... = Don't fragment: Set
        ..0. .... = More fragments: Not set
    ...0 0000 0000 0000 = Fragment Offset: 0
    Time to Live: 127
    Protocol: TCP (6)
    Header Checksum: 0x1e97 [validation disabled]
    [Header checksum status: Unverified]
    Source Address: 30.30.30.1
    Destination Address: 30.30.30.6
Transmission Control Protocol, Src Port: 58192, Dst Port: 10000, Seq: 0, Len: 0
    Source Port: 58192
    Destination Port: 10000
    [Stream index: 0]
    [Conversation completeness: Complete, WITH_DATA (31)]
    [TCP Segment Len: 0]
    Sequence Number: 0    (relative sequence number)
    Sequence Number (raw): 1055380488
    [Next Sequence Number: 1    (relative sequence number)]
    Acknowledgment Number: 0
    Acknowledgment number (raw): 0
    1000 .... = Header Length: 32 bytes (8)
    Flags: 0x002 (SYN)
    Window: 64240
    [Calculated window size: 64240]
    Checksum: 0xde8b [unverified]
    [Checksum Status: Unverified]
    Urgent Pointer: 0
    Options: (12 bytes), Maximum segment size, No-Operation (NOP), Window scale, No-Operation (NOP), No-Operation (NOP), SACK permitted
    [Timestamps]

No.     Time           Source                Destination           Protocol Length Info
      3 6.058422       30.30.30.6            30.30.30.1            TCP      66     10000 → 58192 [SYN, ACK] Seq=0 Ack=1 Win=65535 Len=0 MSS=1460 WS=256 SACK_PERM

Frame 3: 66 bytes on wire (528 bits), 66 bytes captured (528 bits) on interface \Device\NPF_{286628B7-C690-4A38-B5BC-FA4478D21241}, id 0
Ethernet II, Src: RealtekS_68:23:8b (00:e0:4c:68:23:8b), Dst: Cisco_82:0b:84 (00:10:7b:82:0b:84)
Internet Protocol Version 4, Src: 30.30.30.6, Dst: 30.30.30.1
    0100 .... = Version: 4
    .... 0101 = Header Length: 20 bytes (5)
    Differentiated Services Field: 0x00 (DSCP: CS0, ECN: Not-ECT)
    Total Length: 52
    Identification: 0xfbe1 (64481)
    010. .... = Flags: 0x2, Don't fragment
        0... .... = Reserved bit: Not set
        .1.. .... = Don't fragment: Set
        ..0. .... = More fragments: Not set
    ...0 0000 0000 0000 = Fragment Offset: 0
    Time to Live: 128
    Protocol: TCP (6)
    Header Checksum: 0x0000 [validation disabled]
    [Header checksum status: Unverified]
    Source Address: 30.30.30.6
    Destination Address: 30.30.30.1
Transmission Control Protocol, Src Port: 10000, Dst Port: 58192, Seq: 0, Ack: 1, Len: 0
    Source Port: 10000
    Destination Port: 58192
    [Stream index: 0]
    [Conversation completeness: Complete, WITH_DATA (31)]
    [TCP Segment Len: 0]
    Sequence Number: 0    (relative sequence number)
    Sequence Number (raw): 422921487
    [Next Sequence Number: 1    (relative sequence number)]
    Acknowledgment Number: 1    (relative ack number)
    Acknowledgment number (raw): 1055380489
    1000 .... = Header Length: 32 bytes (8)
    Flags: 0x012 (SYN, ACK)
    Window: 65535
    [Calculated window size: 65535]
    Checksum: 0x7869 [unverified]
    [Checksum Status: Unverified]
    Urgent Pointer: 0
    Options: (12 bytes), Maximum segment size, No-Operation (NOP), Window scale, No-Operation (NOP), No-Operation (NOP), SACK permitted
    [Timestamps]
    [SEQ/ACK analysis]

No.     Time           Source                Destination           Protocol Length Info
      4 6.060910       30.30.30.1            30.30.30.6            TCP      60     58192 → 10000 [ACK] Seq=1 Ack=1 Win=65536 Len=0

Frame 4: 60 bytes on wire (480 bits), 60 bytes captured (480 bits) on interface \Device\NPF_{286628B7-C690-4A38-B5BC-FA4478D21241}, id 0
Ethernet II, Src: Cisco_82:0b:84 (00:10:7b:82:0b:84), Dst: RealtekS_68:23:8b (00:e0:4c:68:23:8b)
Internet Protocol Version 4, Src: 30.30.30.1, Dst: 30.30.30.6
    0100 .... = Version: 4
    .... 0101 = Header Length: 20 bytes (5)
    Differentiated Services Field: 0x00 (DSCP: CS0, ECN: Not-ECT)
    Total Length: 40
    Identification: 0x64eb (25835)
    010. .... = Flags: 0x2, Don't fragment
        0... .... = Reserved bit: Not set
        .1.. .... = Don't fragment: Set
        ..0. .... = More fragments: Not set
    ...0 0000 0000 0000 = Fragment Offset: 0
    Time to Live: 127
    Protocol: TCP (6)
    Header Checksum: 0x1ea2 [validation disabled]
    [Header checksum status: Unverified]
    Source Address: 30.30.30.1
    Destination Address: 30.30.30.6
Transmission Control Protocol, Src Port: 58192, Dst Port: 10000, Seq: 1, Ack: 1, Len: 0
    Source Port: 58192
    Destination Port: 10000
    [Stream index: 0]
    [Conversation completeness: Complete, WITH_DATA (31)]
    [TCP Segment Len: 0]
    Sequence Number: 1    (relative sequence number)
    Sequence Number (raw): 1055380489
    [Next Sequence Number: 1    (relative sequence number)]
    Acknowledgment Number: 1    (relative ack number)
    Acknowledgment number (raw): 422921488
    0101 .... = Header Length: 20 bytes (5)
    Flags: 0x010 (ACK)
    Window: 256
    [Calculated window size: 65536]
    [Window size scaling factor: 256]
    Checksum: 0xbafa [unverified]
    [Checksum Status: Unverified]
    Urgent Pointer: 0
    [Timestamps]
    [SEQ/ACK analysis]

No.     Time           Source                Destination           Protocol Length Info
      5 8.844045       Cisco_82:0b:84        Cisco_82:0b:84        LOOP     60     Reply

Frame 5: 60 bytes on wire (480 bits), 60 bytes captured (480 bits) on interface \Device\NPF_{286628B7-C690-4A38-B5BC-FA4478D21241}, id 0
Ethernet II, Src: Cisco_82:0b:84 (00:10:7b:82:0b:84), Dst: Cisco_82:0b:84 (00:10:7b:82:0b:84)
Configuration Test Protocol (loopback)
Data (40 bytes)

0000  00 00 00 00 00 00 00 00 00 00 00 00 00 00 00 00   ................
0010  00 00 00 00 00 00 00 00 00 00 00 00 00 00 00 00   ................
0020  00 00 00 00 00 00 00 00                           ........
    Data: 000000000000000000000000000000000000000000000000000000000000000000000000…
    [Length: 40]

No.     Time           Source                Destination           Protocol Length Info
      6 10.225841      30.30.30.1            30.30.30.6            TCP      60     58192 → 10000 [PSH, ACK] Seq=1 Ack=1 Win=65536 Len=5

Frame 6: 60 bytes on wire (480 bits), 60 bytes captured (480 bits) on interface \Device\NPF_{286628B7-C690-4A38-B5BC-FA4478D21241}, id 0
Ethernet II, Src: Cisco_82:0b:84 (00:10:7b:82:0b:84), Dst: RealtekS_68:23:8b (00:e0:4c:68:23:8b)
Internet Protocol Version 4, Src: 30.30.30.1, Dst: 30.30.30.6
    0100 .... = Version: 4
    .... 0101 = Header Length: 20 bytes (5)
    Differentiated Services Field: 0x00 (DSCP: CS0, ECN: Not-ECT)
    Total Length: 45
    Identification: 0x64ec (25836)
    010. .... = Flags: 0x2, Don't fragment
        0... .... = Reserved bit: Not set
        .1.. .... = Don't fragment: Set
        ..0. .... = More fragments: Not set
    ...0 0000 0000 0000 = Fragment Offset: 0
    Time to Live: 127
    Protocol: TCP (6)
    Header Checksum: 0x1e9c [validation disabled]
    [Header checksum status: Unverified]
    Source Address: 30.30.30.1
    Destination Address: 30.30.30.6
Transmission Control Protocol, Src Port: 58192, Dst Port: 10000, Seq: 1, Ack: 1, Len: 5
    Source Port: 58192
    Destination Port: 10000
    [Stream index: 0]
    [Conversation completeness: Complete, WITH_DATA (31)]
    [TCP Segment Len: 5]
    Sequence Number: 1    (relative sequence number)
    Sequence Number (raw): 1055380489
    [Next Sequence Number: 6    (relative sequence number)]
    Acknowledgment Number: 1    (relative ack number)
    Acknowledgment number (raw): 422921488
    0101 .... = Header Length: 20 bytes (5)
    Flags: 0x018 (PSH, ACK)
    Window: 256
    [Calculated window size: 65536]
    [Window size scaling factor: 256]
    Checksum: 0x7e1b [unverified]
    [Checksum Status: Unverified]
    Urgent Pointer: 0
    [Timestamps]
    [SEQ/ACK analysis]
    TCP payload (5 bytes)
Data (5 bytes)

0000  61 69 67 68 74                                    aight
    Data: 6169676874
    [Length: 5]

No.     Time           Source                Destination           Protocol Length Info
      7 10.278389      30.30.30.6            30.30.30.1            TCP      54     10000 → 58192 [ACK] Seq=1 Ack=6 Win=525568 Len=0

Frame 7: 54 bytes on wire (432 bits), 54 bytes captured (432 bits) on interface \Device\NPF_{286628B7-C690-4A38-B5BC-FA4478D21241}, id 0
Ethernet II, Src: RealtekS_68:23:8b (00:e0:4c:68:23:8b), Dst: Cisco_82:0b:84 (00:10:7b:82:0b:84)
Internet Protocol Version 4, Src: 30.30.30.6, Dst: 30.30.30.1
    0100 .... = Version: 4
    .... 0101 = Header Length: 20 bytes (5)
    Differentiated Services Field: 0x00 (DSCP: CS0, ECN: Not-ECT)
    Total Length: 40
    Identification: 0xfbe2 (64482)
    010. .... = Flags: 0x2, Don't fragment
        0... .... = Reserved bit: Not set
        .1.. .... = Don't fragment: Set
        ..0. .... = More fragments: Not set
    ...0 0000 0000 0000 = Fragment Offset: 0
    Time to Live: 128
    Protocol: TCP (6)
    Header Checksum: 0x0000 [validation disabled]
    [Header checksum status: Unverified]
    Source Address: 30.30.30.6
    Destination Address: 30.30.30.1
Transmission Control Protocol, Src Port: 10000, Dst Port: 58192, Seq: 1, Ack: 6, Len: 0
    Source Port: 10000
    Destination Port: 58192
    [Stream index: 0]
    [Conversation completeness: Complete, WITH_DATA (31)]
    [TCP Segment Len: 0]
    Sequence Number: 1    (relative sequence number)
    Sequence Number (raw): 422921488
    [Next Sequence Number: 1    (relative sequence number)]
    Acknowledgment Number: 6    (relative ack number)
    Acknowledgment number (raw): 1055380494
    0101 .... = Header Length: 20 bytes (5)
    Flags: 0x010 (ACK)
    Window: 2053
    [Calculated window size: 525568]
    [Window size scaling factor: 256]
    Checksum: 0x785d [unverified]
    [Checksum Status: Unverified]
    Urgent Pointer: 0
    [Timestamps]
    [SEQ/ACK analysis]

No.     Time           Source                Destination           Protocol Length Info
      8 12.557227      30.30.30.6            239.255.255.250       SSDP     216    M-SEARCH * HTTP/1.1 

Frame 8: 216 bytes on wire (1728 bits), 216 bytes captured (1728 bits) on interface \Device\NPF_{286628B7-C690-4A38-B5BC-FA4478D21241}, id 0
Ethernet II, Src: RealtekS_68:23:8b (00:e0:4c:68:23:8b), Dst: IPv4mcast_7f:ff:fa (01:00:5e:7f:ff:fa)
Internet Protocol Version 4, Src: 30.30.30.6, Dst: 239.255.255.250
    0100 .... = Version: 4
    .... 0101 = Header Length: 20 bytes (5)
    Differentiated Services Field: 0x00 (DSCP: CS0, ECN: Not-ECT)
    Total Length: 202
    Identification: 0xdc22 (56354)
    000. .... = Flags: 0x0
        0... .... = Reserved bit: Not set
        .0.. .... = Don't fragment: Not set
        ..0. .... = More fragments: Not set
    ...0 0000 0000 0000 = Fragment Offset: 0
    Time to Live: 1
    Protocol: UDP (17)
    Header Checksum: 0x0000 [validation disabled]
    [Header checksum status: Unverified]
    Source Address: 30.30.30.6
    Destination Address: 239.255.255.250
User Datagram Protocol, Src Port: 49670, Dst Port: 1900
Simple Service Discovery Protocol

No.     Time           Source                Destination           Protocol Length Info
      9 13.563012      30.30.30.6            239.255.255.250       SSDP     216    M-SEARCH * HTTP/1.1 

Frame 9: 216 bytes on wire (1728 bits), 216 bytes captured (1728 bits) on interface \Device\NPF_{286628B7-C690-4A38-B5BC-FA4478D21241}, id 0
Ethernet II, Src: RealtekS_68:23:8b (00:e0:4c:68:23:8b), Dst: IPv4mcast_7f:ff:fa (01:00:5e:7f:ff:fa)
Internet Protocol Version 4, Src: 30.30.30.6, Dst: 239.255.255.250
    0100 .... = Version: 4
    .... 0101 = Header Length: 20 bytes (5)
    Differentiated Services Field: 0x00 (DSCP: CS0, ECN: Not-ECT)
    Total Length: 202
    Identification: 0xdc23 (56355)
    000. .... = Flags: 0x0
        0... .... = Reserved bit: Not set
        .0.. .... = Don't fragment: Not set
        ..0. .... = More fragments: Not set
    ...0 0000 0000 0000 = Fragment Offset: 0
    Time to Live: 1
    Protocol: UDP (17)
    Header Checksum: 0x0000 [validation disabled]
    [Header checksum status: Unverified]
    Source Address: 30.30.30.6
    Destination Address: 239.255.255.250
User Datagram Protocol, Src Port: 49670, Dst Port: 1900
Simple Service Discovery Protocol

No.     Time           Source                Destination           Protocol Length Info
     10 14.578221      30.30.30.6            239.255.255.250       SSDP     216    M-SEARCH * HTTP/1.1 

Frame 10: 216 bytes on wire (1728 bits), 216 bytes captured (1728 bits) on interface \Device\NPF_{286628B7-C690-4A38-B5BC-FA4478D21241}, id 0
Ethernet II, Src: RealtekS_68:23:8b (00:e0:4c:68:23:8b), Dst: IPv4mcast_7f:ff:fa (01:00:5e:7f:ff:fa)
Internet Protocol Version 4, Src: 30.30.30.6, Dst: 239.255.255.250
    0100 .... = Version: 4
    .... 0101 = Header Length: 20 bytes (5)
    Differentiated Services Field: 0x00 (DSCP: CS0, ECN: Not-ECT)
    Total Length: 202
    Identification: 0xdc24 (56356)
    000. .... = Flags: 0x0
        0... .... = Reserved bit: Not set
        .0.. .... = Don't fragment: Not set
        ..0. .... = More fragments: Not set
    ...0 0000 0000 0000 = Fragment Offset: 0
    Time to Live: 1
    Protocol: UDP (17)
    Header Checksum: 0x0000 [validation disabled]
    [Header checksum status: Unverified]
    Source Address: 30.30.30.6
    Destination Address: 239.255.255.250
User Datagram Protocol, Src Port: 49670, Dst Port: 1900
Simple Service Discovery Protocol

No.     Time           Source                Destination           Protocol Length Info
     11 15.502164      30.30.30.6            30.30.30.1            TCP      62     10000 → 58192 [PSH, ACK] Seq=1 Ack=6 Win=525568 Len=8

Frame 11: 62 bytes on wire (496 bits), 62 bytes captured (496 bits) on interface \Device\NPF_{286628B7-C690-4A38-B5BC-FA4478D21241}, id 0
Ethernet II, Src: RealtekS_68:23:8b (00:e0:4c:68:23:8b), Dst: Cisco_82:0b:84 (00:10:7b:82:0b:84)
Internet Protocol Version 4, Src: 30.30.30.6, Dst: 30.30.30.1
    0100 .... = Version: 4
    .... 0101 = Header Length: 20 bytes (5)
    Differentiated Services Field: 0x00 (DSCP: CS0, ECN: Not-ECT)
    Total Length: 48
    Identification: 0xfbe3 (64483)
    010. .... = Flags: 0x2, Don't fragment
        0... .... = Reserved bit: Not set
        .1.. .... = Don't fragment: Set
        ..0. .... = More fragments: Not set
    ...0 0000 0000 0000 = Fragment Offset: 0
    Time to Live: 128
    Protocol: TCP (6)
    Header Checksum: 0x0000 [validation disabled]
    [Header checksum status: Unverified]
    Source Address: 30.30.30.6
    Destination Address: 30.30.30.1
Transmission Control Protocol, Src Port: 10000, Dst Port: 58192, Seq: 1, Ack: 6, Len: 8
    Source Port: 10000
    Destination Port: 58192
    [Stream index: 0]
    [Conversation completeness: Complete, WITH_DATA (31)]
    [TCP Segment Len: 8]
    Sequence Number: 1    (relative sequence number)
    Sequence Number (raw): 422921488
    [Next Sequence Number: 9    (relative sequence number)]
    Acknowledgment Number: 6    (relative ack number)
    Acknowledgment number (raw): 1055380494
    0101 .... = Header Length: 20 bytes (5)
    Flags: 0x018 (PSH, ACK)
    Window: 2053
    [Calculated window size: 525568]
    [Window size scaling factor: 256]
    Checksum: 0x7865 [unverified]
    [Checksum Status: Unverified]
    Urgent Pointer: 0
    [Timestamps]
    [SEQ/ACK analysis]
    TCP payload (8 bytes)
Data (8 bytes)

0000  6e 6f 77 20 77 68 61 74                           now what
    Data: 6e6f772077686174
    [Length: 8]

No.     Time           Source                Destination           Protocol Length Info
     12 15.555098      30.30.30.1            30.30.30.6            TCP      60     58192 → 10000 [ACK] Seq=6 Ack=9 Win=65536 Len=0

Frame 12: 60 bytes on wire (480 bits), 60 bytes captured (480 bits) on interface \Device\NPF_{286628B7-C690-4A38-B5BC-FA4478D21241}, id 0
Ethernet II, Src: Cisco_82:0b:84 (00:10:7b:82:0b:84), Dst: RealtekS_68:23:8b (00:e0:4c:68:23:8b)
Internet Protocol Version 4, Src: 30.30.30.1, Dst: 30.30.30.6
    0100 .... = Version: 4
    .... 0101 = Header Length: 20 bytes (5)
    Differentiated Services Field: 0x00 (DSCP: CS0, ECN: Not-ECT)
    Total Length: 40
    Identification: 0x64ed (25837)
    010. .... = Flags: 0x2, Don't fragment
        0... .... = Reserved bit: Not set
        .1.. .... = Don't fragment: Set
        ..0. .... = More fragments: Not set
    ...0 0000 0000 0000 = Fragment Offset: 0
    Time to Live: 127
    Protocol: TCP (6)
    Header Checksum: 0x1ea0 [validation disabled]
    [Header checksum status: Unverified]
    Source Address: 30.30.30.1
    Destination Address: 30.30.30.6
Transmission Control Protocol, Src Port: 58192, Dst Port: 10000, Seq: 6, Ack: 9, Len: 0
    Source Port: 58192
    Destination Port: 10000
    [Stream index: 0]
    [Conversation completeness: Complete, WITH_DATA (31)]
    [TCP Segment Len: 0]
    Sequence Number: 6    (relative sequence number)
    Sequence Number (raw): 1055380494
    [Next Sequence Number: 6    (relative sequence number)]
    Acknowledgment Number: 9    (relative ack number)
    Acknowledgment number (raw): 422921496
    0101 .... = Header Length: 20 bytes (5)
    Flags: 0x010 (ACK)
    Window: 256
    [Calculated window size: 65536]
    [Window size scaling factor: 256]
    Checksum: 0xbaed [unverified]
    [Checksum Status: Unverified]
    Urgent Pointer: 0
    [Timestamps]
    [SEQ/ACK analysis]

No.     Time           Source                Destination           Protocol Length Info
     13 15.592569      30.30.30.6            239.255.255.250       SSDP     216    M-SEARCH * HTTP/1.1 

Frame 13: 216 bytes on wire (1728 bits), 216 bytes captured (1728 bits) on interface \Device\NPF_{286628B7-C690-4A38-B5BC-FA4478D21241}, id 0
Ethernet II, Src: RealtekS_68:23:8b (00:e0:4c:68:23:8b), Dst: IPv4mcast_7f:ff:fa (01:00:5e:7f:ff:fa)
Internet Protocol Version 4, Src: 30.30.30.6, Dst: 239.255.255.250
    0100 .... = Version: 4
    .... 0101 = Header Length: 20 bytes (5)
    Differentiated Services Field: 0x00 (DSCP: CS0, ECN: Not-ECT)
    Total Length: 202
    Identification: 0xdc25 (56357)
    000. .... = Flags: 0x0
        0... .... = Reserved bit: Not set
        .0.. .... = Don't fragment: Not set
        ..0. .... = More fragments: Not set
    ...0 0000 0000 0000 = Fragment Offset: 0
    Time to Live: 1
    Protocol: UDP (17)
    Header Checksum: 0x0000 [validation disabled]
    [Header checksum status: Unverified]
    Source Address: 30.30.30.6
    Destination Address: 239.255.255.250
User Datagram Protocol, Src Port: 49670, Dst Port: 1900
Simple Service Discovery Protocol

No.     Time           Source                Destination           Protocol Length Info
     14 18.844294      Cisco_82:0b:84        Cisco_82:0b:84        LOOP     60     Reply

Frame 14: 60 bytes on wire (480 bits), 60 bytes captured (480 bits) on interface \Device\NPF_{286628B7-C690-4A38-B5BC-FA4478D21241}, id 0
Ethernet II, Src: Cisco_82:0b:84 (00:10:7b:82:0b:84), Dst: Cisco_82:0b:84 (00:10:7b:82:0b:84)
Configuration Test Protocol (loopback)
Data (40 bytes)

0000  00 00 00 00 00 00 00 00 00 00 00 00 00 00 00 00   ................
0010  00 00 00 00 00 00 00 00 00 00 00 00 00 00 00 00   ................
0020  00 00 00 00 00 00 00 00                           ........
    Data: 000000000000000000000000000000000000000000000000000000000000000000000000…
    [Length: 40]

No.     Time           Source                Destination           Protocol Length Info
     15 21.001839      30.30.30.1            30.30.30.6            TCP      67     58192 → 10000 [PSH, ACK] Seq=6 Ack=9 Win=65536 Len=13

Frame 15: 67 bytes on wire (536 bits), 67 bytes captured (536 bits) on interface \Device\NPF_{286628B7-C690-4A38-B5BC-FA4478D21241}, id 0
Ethernet II, Src: Cisco_82:0b:84 (00:10:7b:82:0b:84), Dst: RealtekS_68:23:8b (00:e0:4c:68:23:8b)
Internet Protocol Version 4, Src: 30.30.30.1, Dst: 30.30.30.6
    0100 .... = Version: 4
    .... 0101 = Header Length: 20 bytes (5)
    Differentiated Services Field: 0x00 (DSCP: CS0, ECN: Not-ECT)
    Total Length: 53
    Identification: 0x64ee (25838)
    010. .... = Flags: 0x2, Don't fragment
        0... .... = Reserved bit: Not set
        .1.. .... = Don't fragment: Set
        ..0. .... = More fragments: Not set
    ...0 0000 0000 0000 = Fragment Offset: 0
    Time to Live: 127
    Protocol: TCP (6)
    Header Checksum: 0x1e92 [validation disabled]
    [Header checksum status: Unverified]
    Source Address: 30.30.30.1
    Destination Address: 30.30.30.6
Transmission Control Protocol, Src Port: 58192, Dst Port: 10000, Seq: 6, Ack: 9, Len: 13
    Source Port: 58192
    Destination Port: 10000
    [Stream index: 0]
    [Conversation completeness: Complete, WITH_DATA (31)]
    [TCP Segment Len: 13]
    Sequence Number: 6    (relative sequence number)
    Sequence Number (raw): 1055380494
    [Next Sequence Number: 19    (relative sequence number)]
    Acknowledgment Number: 9    (relative ack number)
    Acknowledgment number (raw): 422921496
    0101 .... = Header Length: 20 bytes (5)
    Flags: 0x018 (PSH, ACK)
    Window: 256
    [Calculated window size: 65536]
    [Window size scaling factor: 256]
    Checksum: 0x41ea [unverified]
    [Checksum Status: Unverified]
    Urgent Pointer: 0
    [Timestamps]
    [SEQ/ACK analysis]
    TCP payload (13 bytes)
Data (13 bytes)

0000  49 20 67 6f 74 20 6e 6f 20 69 64 65 61            I got no idea
    Data: 4920676f74206e6f2069646561
    [Length: 13]

No.     Time           Source                Destination           Protocol Length Info
     16 21.050652      30.30.30.6            30.30.30.1            TCP      54     10000 → 58192 [ACK] Seq=9 Ack=19 Win=525568 Len=0

Frame 16: 54 bytes on wire (432 bits), 54 bytes captured (432 bits) on interface \Device\NPF_{286628B7-C690-4A38-B5BC-FA4478D21241}, id 0
Ethernet II, Src: RealtekS_68:23:8b (00:e0:4c:68:23:8b), Dst: Cisco_82:0b:84 (00:10:7b:82:0b:84)
Internet Protocol Version 4, Src: 30.30.30.6, Dst: 30.30.30.1
    0100 .... = Version: 4
    .... 0101 = Header Length: 20 bytes (5)
    Differentiated Services Field: 0x00 (DSCP: CS0, ECN: Not-ECT)
    Total Length: 40
    Identification: 0xfbe4 (64484)
    010. .... = Flags: 0x2, Don't fragment
        0... .... = Reserved bit: Not set
        .1.. .... = Don't fragment: Set
        ..0. .... = More fragments: Not set
    ...0 0000 0000 0000 = Fragment Offset: 0
    Time to Live: 128
    Protocol: TCP (6)
    Header Checksum: 0x0000 [validation disabled]
    [Header checksum status: Unverified]
    Source Address: 30.30.30.6
    Destination Address: 30.30.30.1
Transmission Control Protocol, Src Port: 10000, Dst Port: 58192, Seq: 9, Ack: 19, Len: 0
    Source Port: 10000
    Destination Port: 58192
    [Stream index: 0]
    [Conversation completeness: Complete, WITH_DATA (31)]
    [TCP Segment Len: 0]
    Sequence Number: 9    (relative sequence number)
    Sequence Number (raw): 422921496
    [Next Sequence Number: 9    (relative sequence number)]
    Acknowledgment Number: 19    (relative ack number)
    Acknowledgment number (raw): 1055380507
    0101 .... = Header Length: 20 bytes (5)
    Flags: 0x010 (ACK)
    Window: 2053
    [Calculated window size: 525568]
    [Window size scaling factor: 256]
    Checksum: 0x785d [unverified]
    [Checksum Status: Unverified]
    Urgent Pointer: 0
    [Timestamps]
    [SEQ/ACK analysis]

No.     Time           Source                Destination           Protocol Length Info
     17 23.710088      30.30.30.6            30.30.30.1            TCP      57     10000 → 58192 [PSH, ACK] Seq=9 Ack=19 Win=525568 Len=3 [TCP segment of a reassembled PDU]

Frame 17: 57 bytes on wire (456 bits), 57 bytes captured (456 bits) on interface \Device\NPF_{286628B7-C690-4A38-B5BC-FA4478D21241}, id 0
Ethernet II, Src: RealtekS_68:23:8b (00:e0:4c:68:23:8b), Dst: Cisco_82:0b:84 (00:10:7b:82:0b:84)
Internet Protocol Version 4, Src: 30.30.30.6, Dst: 30.30.30.1
    0100 .... = Version: 4
    .... 0101 = Header Length: 20 bytes (5)
    Differentiated Services Field: 0x00 (DSCP: CS0, ECN: Not-ECT)
    Total Length: 43
    Identification: 0xfbe5 (64485)
    010. .... = Flags: 0x2, Don't fragment
        0... .... = Reserved bit: Not set
        .1.. .... = Don't fragment: Set
        ..0. .... = More fragments: Not set
    ...0 0000 0000 0000 = Fragment Offset: 0
    Time to Live: 128
    Protocol: TCP (6)
    Header Checksum: 0x0000 [validation disabled]
    [Header checksum status: Unverified]
    Source Address: 30.30.30.6
    Destination Address: 30.30.30.1
Transmission Control Protocol, Src Port: 10000, Dst Port: 58192, Seq: 9, Ack: 19, Len: 3
    Source Port: 10000
    Destination Port: 58192
    [Stream index: 0]
    [Conversation completeness: Complete, WITH_DATA (31)]
    [TCP Segment Len: 3]
    Sequence Number: 9    (relative sequence number)
    Sequence Number (raw): 422921496
    [Next Sequence Number: 12    (relative sequence number)]
    Acknowledgment Number: 19    (relative ack number)
    Acknowledgment number (raw): 1055380507
    0101 .... = Header Length: 20 bytes (5)
    Flags: 0x018 (PSH, ACK)
    Window: 2053
    [Calculated window size: 525568]
    [Window size scaling factor: 256]
    Checksum: 0x7860 [unverified]
    [Checksum Status: Unverified]
    Urgent Pointer: 0
    [Timestamps]
    [SEQ/ACK analysis]
    TCP payload (3 bytes)
    [Reassembled PDU in frame: 22]
    TCP segment data (3 bytes)

No.     Time           Source                Destination           Protocol Length Info
     18 23.768527      30.30.30.1            30.30.30.6            TCP      60     58192 → 10000 [ACK] Seq=19 Ack=12 Win=65536 Len=0

Frame 18: 60 bytes on wire (480 bits), 60 bytes captured (480 bits) on interface \Device\NPF_{286628B7-C690-4A38-B5BC-FA4478D21241}, id 0
Ethernet II, Src: Cisco_82:0b:84 (00:10:7b:82:0b:84), Dst: RealtekS_68:23:8b (00:e0:4c:68:23:8b)
Internet Protocol Version 4, Src: 30.30.30.1, Dst: 30.30.30.6
    0100 .... = Version: 4
    .... 0101 = Header Length: 20 bytes (5)
    Differentiated Services Field: 0x00 (DSCP: CS0, ECN: Not-ECT)
    Total Length: 40
    Identification: 0x64ef (25839)
    010. .... = Flags: 0x2, Don't fragment
        0... .... = Reserved bit: Not set
        .1.. .... = Don't fragment: Set
        ..0. .... = More fragments: Not set
    ...0 0000 0000 0000 = Fragment Offset: 0
    Time to Live: 127
    Protocol: TCP (6)
    Header Checksum: 0x1e9e [validation disabled]
    [Header checksum status: Unverified]
    Source Address: 30.30.30.1
    Destination Address: 30.30.30.6
Transmission Control Protocol, Src Port: 58192, Dst Port: 10000, Seq: 19, Ack: 12, Len: 0
    Source Port: 58192
    Destination Port: 10000
    [Stream index: 0]
    [Conversation completeness: Complete, WITH_DATA (31)]
    [TCP Segment Len: 0]
    Sequence Number: 19    (relative sequence number)
    Sequence Number (raw): 1055380507
    [Next Sequence Number: 19    (relative sequence number)]
    Acknowledgment Number: 12    (relative ack number)
    Acknowledgment number (raw): 422921499
    0101 .... = Header Length: 20 bytes (5)
    Flags: 0x010 (ACK)
    Window: 256
    [Calculated window size: 65536]
    [Window size scaling factor: 256]
    Checksum: 0xbadd [unverified]
    [Checksum Status: Unverified]
    Urgent Pointer: 0
    [Timestamps]
    [SEQ/ACK analysis]

No.     Time           Source                Destination           Protocol Length Info
     19 28.844433      Cisco_82:0b:84        Cisco_82:0b:84        LOOP     60     Reply

Frame 19: 60 bytes on wire (480 bits), 60 bytes captured (480 bits) on interface \Device\NPF_{286628B7-C690-4A38-B5BC-FA4478D21241}, id 0
Ethernet II, Src: Cisco_82:0b:84 (00:10:7b:82:0b:84), Dst: Cisco_82:0b:84 (00:10:7b:82:0b:84)
Configuration Test Protocol (loopback)
Data (40 bytes)

0000  00 00 00 00 00 00 00 00 00 00 00 00 00 00 00 00   ................
0010  00 00 00 00 00 00 00 00 00 00 00 00 00 00 00 00   ................
0020  00 00 00 00 00 00 00 00                           ........
    Data: 000000000000000000000000000000000000000000000000000000000000000000000000…
    [Length: 40]

No.     Time           Source                Destination           Protocol Length Info
     20 29.090152      30.30.30.1            30.30.30.6            TCP      83     58192 → 10000 [PSH, ACK] Seq=19 Ack=12 Win=65536 Len=29

Frame 20: 83 bytes on wire (664 bits), 83 bytes captured (664 bits) on interface \Device\NPF_{286628B7-C690-4A38-B5BC-FA4478D21241}, id 0
Ethernet II, Src: Cisco_82:0b:84 (00:10:7b:82:0b:84), Dst: RealtekS_68:23:8b (00:e0:4c:68:23:8b)
Internet Protocol Version 4, Src: 30.30.30.1, Dst: 30.30.30.6
    0100 .... = Version: 4
    .... 0101 = Header Length: 20 bytes (5)
    Differentiated Services Field: 0x00 (DSCP: CS0, ECN: Not-ECT)
    Total Length: 69
    Identification: 0x64f0 (25840)
    010. .... = Flags: 0x2, Don't fragment
        0... .... = Reserved bit: Not set
        .1.. .... = Don't fragment: Set
        ..0. .... = More fragments: Not set
    ...0 0000 0000 0000 = Fragment Offset: 0
    Time to Live: 127
    Protocol: TCP (6)
    Header Checksum: 0x1e80 [validation disabled]
    [Header checksum status: Unverified]
    Source Address: 30.30.30.1
    Destination Address: 30.30.30.6
Transmission Control Protocol, Src Port: 58192, Dst Port: 10000, Seq: 19, Ack: 12, Len: 29
    Source Port: 58192
    Destination Port: 10000
    [Stream index: 0]
    [Conversation completeness: Complete, WITH_DATA (31)]
    [TCP Segment Len: 29]
    Sequence Number: 19    (relative sequence number)
    Sequence Number (raw): 1055380507
    [Next Sequence Number: 48    (relative sequence number)]
    Acknowledgment Number: 12    (relative ack number)
    Acknowledgment number (raw): 422921499
    0101 .... = Header Length: 20 bytes (5)
    Flags: 0x018 (PSH, ACK)
    Window: 256
    [Calculated window size: 65536]
    [Window size scaling factor: 256]
    Checksum: 0xddfd [unverified]
    [Checksum Status: Unverified]
    Urgent Pointer: 0
    [Timestamps]
    [SEQ/ACK analysis]
    TCP payload (29 bytes)
Data (29 bytes)

0000  79 65 61 68 20 69 20 67 75 65 73 73 20 77 65 20   yeah i guess we 
0010  6a 75 73 74 20 73 69 74 20 68 65 72 65            just sit here
    Data: 796561682069206775657373207765206a757374207369742068657265
    [Length: 29]

No.     Time           Source                Destination           Protocol Length Info
     21 29.136069      30.30.30.6            30.30.30.1            TCP      54     10000 → 58192 [ACK] Seq=12 Ack=48 Win=525312 Len=0

Frame 21: 54 bytes on wire (432 bits), 54 bytes captured (432 bits) on interface \Device\NPF_{286628B7-C690-4A38-B5BC-FA4478D21241}, id 0
Ethernet II, Src: RealtekS_68:23:8b (00:e0:4c:68:23:8b), Dst: Cisco_82:0b:84 (00:10:7b:82:0b:84)
Internet Protocol Version 4, Src: 30.30.30.6, Dst: 30.30.30.1
    0100 .... = Version: 4
    .... 0101 = Header Length: 20 bytes (5)
    Differentiated Services Field: 0x00 (DSCP: CS0, ECN: Not-ECT)
    Total Length: 40
    Identification: 0xfbe6 (64486)
    010. .... = Flags: 0x2, Don't fragment
        0... .... = Reserved bit: Not set
        .1.. .... = Don't fragment: Set
        ..0. .... = More fragments: Not set
    ...0 0000 0000 0000 = Fragment Offset: 0
    Time to Live: 128
    Protocol: TCP (6)
    Header Checksum: 0x0000 [validation disabled]
    [Header checksum status: Unverified]
    Source Address: 30.30.30.6
    Destination Address: 30.30.30.1
Transmission Control Protocol, Src Port: 10000, Dst Port: 58192, Seq: 12, Ack: 48, Len: 0
    Source Port: 10000
    Destination Port: 58192
    [Stream index: 0]
    [Conversation completeness: Complete, WITH_DATA (31)]
    [TCP Segment Len: 0]
    Sequence Number: 12    (relative sequence number)
    Sequence Number (raw): 422921499
    [Next Sequence Number: 12    (relative sequence number)]
    Acknowledgment Number: 48    (relative ack number)
    Acknowledgment number (raw): 1055380536
    0101 .... = Header Length: 20 bytes (5)
    Flags: 0x010 (ACK)
    Window: 2052
    [Calculated window size: 525312]
    [Window size scaling factor: 256]
    Checksum: 0x785d [unverified]
    [Checksum Status: Unverified]
    Urgent Pointer: 0
    [Timestamps]
    [SEQ/ACK analysis]

No.     Time           Source                Destination           Protocol Length Info
     22 33.539269      30.30.30.6            30.30.30.1            TCP      68     10000 → 58192 [PSH, ACK] Seq=12 Ack=48 Win=525312 Len=14

Frame 22: 68 bytes on wire (544 bits), 68 bytes captured (544 bits) on interface \Device\NPF_{286628B7-C690-4A38-B5BC-FA4478D21241}, id 0
Ethernet II, Src: RealtekS_68:23:8b (00:e0:4c:68:23:8b), Dst: Cisco_82:0b:84 (00:10:7b:82:0b:84)
Internet Protocol Version 4, Src: 30.30.30.6, Dst: 30.30.30.1
    0100 .... = Version: 4
    .... 0101 = Header Length: 20 bytes (5)
    Differentiated Services Field: 0x00 (DSCP: CS0, ECN: Not-ECT)
    Total Length: 54
    Identification: 0xfbe7 (64487)
    010. .... = Flags: 0x2, Don't fragment
        0... .... = Reserved bit: Not set
        .1.. .... = Don't fragment: Set
        ..0. .... = More fragments: Not set
    ...0 0000 0000 0000 = Fragment Offset: 0
    Time to Live: 128
    Protocol: TCP (6)
    Header Checksum: 0x0000 [validation disabled]
    [Header checksum status: Unverified]
    Source Address: 30.30.30.6
    Destination Address: 30.30.30.1
Transmission Control Protocol, Src Port: 10000, Dst Port: 58192, Seq: 12, Ack: 48, Len: 14
    Source Port: 10000
    Destination Port: 58192
    [Stream index: 0]
    [Conversation completeness: Complete, WITH_DATA (31)]
    [TCP Segment Len: 14]
    Sequence Number: 12    (relative sequence number)
    Sequence Number (raw): 422921499
    [Next Sequence Number: 26    (relative sequence number)]
    Acknowledgment Number: 48    (relative ack number)
    Acknowledgment number (raw): 1055380536
    0101 .... = Header Length: 20 bytes (5)
    Flags: 0x018 (PSH, ACK)
    Window: 2052
    [Calculated window size: 525312]
    [Window size scaling factor: 256]
    Checksum: 0x786b [unverified]
    [Checksum Status: Unverified]
    Urgent Pointer: 0
    [Timestamps]
    [SEQ/ACK analysis]
    TCP payload (14 bytes)
    TCP segment data (14 bytes)
[2 Reassembled TCP Segments (17 bytes): #17(3), #22(14)]
Data (17 bytes)

0000  6f 6f 66 69 74 20 62 65 20 6c 69 6b 65 20 74 68   oofit be like th
0010  61                                                a
    Data: 6f6f666974206265206c696b6520746861
    [Length: 17]

No.     Time           Source                Destination           Protocol Length Info
     23 33.581459      30.30.30.1            30.30.30.6            TCP      60     58192 → 10000 [ACK] Seq=48 Ack=26 Win=65536 Len=0

Frame 23: 60 bytes on wire (480 bits), 60 bytes captured (480 bits) on interface \Device\NPF_{286628B7-C690-4A38-B5BC-FA4478D21241}, id 0
Ethernet II, Src: Cisco_82:0b:84 (00:10:7b:82:0b:84), Dst: RealtekS_68:23:8b (00:e0:4c:68:23:8b)
Internet Protocol Version 4, Src: 30.30.30.1, Dst: 30.30.30.6
    0100 .... = Version: 4
    .... 0101 = Header Length: 20 bytes (5)
    Differentiated Services Field: 0x00 (DSCP: CS0, ECN: Not-ECT)
    Total Length: 40
    Identification: 0x64f1 (25841)
    010. .... = Flags: 0x2, Don't fragment
        0... .... = Reserved bit: Not set
        .1.. .... = Don't fragment: Set
        ..0. .... = More fragments: Not set
    ...0 0000 0000 0000 = Fragment Offset: 0
    Time to Live: 127
    Protocol: TCP (6)
    Header Checksum: 0x1e9c [validation disabled]
    [Header checksum status: Unverified]
    Source Address: 30.30.30.1
    Destination Address: 30.30.30.6
Transmission Control Protocol, Src Port: 58192, Dst Port: 10000, Seq: 48, Ack: 26, Len: 0
    Source Port: 58192
    Destination Port: 10000
    [Stream index: 0]
    [Conversation completeness: Complete, WITH_DATA (31)]
    [TCP Segment Len: 0]
    Sequence Number: 48    (relative sequence number)
    Sequence Number (raw): 1055380536
    [Next Sequence Number: 48    (relative sequence number)]
    Acknowledgment Number: 26    (relative ack number)
    Acknowledgment number (raw): 422921513
    0101 .... = Header Length: 20 bytes (5)
    Flags: 0x010 (ACK)
    Window: 256
    [Calculated window size: 65536]
    [Window size scaling factor: 256]
    Checksum: 0xbab2 [unverified]
    [Checksum Status: Unverified]
    Urgent Pointer: 0
    [Timestamps]
    [SEQ/ACK analysis]

No.     Time           Source                Destination           Protocol Length Info
     24 33.860956      RealtekS_68:23:8b     Cisco_82:0b:84        ARP      42     Who has 30.30.30.5? Tell 30.30.30.6

Frame 24: 42 bytes on wire (336 bits), 42 bytes captured (336 bits) on interface \Device\NPF_{286628B7-C690-4A38-B5BC-FA4478D21241}, id 0
Ethernet II, Src: RealtekS_68:23:8b (00:e0:4c:68:23:8b), Dst: Cisco_82:0b:84 (00:10:7b:82:0b:84)
Address Resolution Protocol (request)

No.     Time           Source                Destination           Protocol Length Info
     25 33.864405      Cisco_82:0b:84        RealtekS_68:23:8b     ARP      60     30.30.30.5 is at 00:10:7b:82:0b:84

Frame 25: 60 bytes on wire (480 bits), 60 bytes captured (480 bits) on interface \Device\NPF_{286628B7-C690-4A38-B5BC-FA4478D21241}, id 0
Ethernet II, Src: Cisco_82:0b:84 (00:10:7b:82:0b:84), Dst: RealtekS_68:23:8b (00:e0:4c:68:23:8b)
Address Resolution Protocol (reply)

No.     Time           Source                Destination           Protocol Length Info
     26 36.307554      30.30.30.1            30.30.30.6            TCP      60     58192 → 10000 [PSH, ACK] Seq=48 Ack=26 Win=65536 Len=4

Frame 26: 60 bytes on wire (480 bits), 60 bytes captured (480 bits) on interface \Device\NPF_{286628B7-C690-4A38-B5BC-FA4478D21241}, id 0
Ethernet II, Src: Cisco_82:0b:84 (00:10:7b:82:0b:84), Dst: RealtekS_68:23:8b (00:e0:4c:68:23:8b)
Internet Protocol Version 4, Src: 30.30.30.1, Dst: 30.30.30.6
    0100 .... = Version: 4
    .... 0101 = Header Length: 20 bytes (5)
    Differentiated Services Field: 0x00 (DSCP: CS0, ECN: Not-ECT)
    Total Length: 44
    Identification: 0x64f2 (25842)
    010. .... = Flags: 0x2, Don't fragment
        0... .... = Reserved bit: Not set
        .1.. .... = Don't fragment: Set
        ..0. .... = More fragments: Not set
    ...0 0000 0000 0000 = Fragment Offset: 0
    Time to Live: 127
    Protocol: TCP (6)
    Header Checksum: 0x1e97 [validation disabled]
    [Header checksum status: Unverified]
    Source Address: 30.30.30.1
    Destination Address: 30.30.30.6
Transmission Control Protocol, Src Port: 58192, Dst Port: 10000, Seq: 48, Ack: 26, Len: 4
    Source Port: 58192
    Destination Port: 10000
    [Stream index: 0]
    [Conversation completeness: Complete, WITH_DATA (31)]
    [TCP Segment Len: 4]
