No.     Time           Source                Destination           Protocol Length Info
      1 0.000000       Cisco_82:0b:84        Cisco_82:0b:84        LOOP     60     Reply

Frame 1: 60 bytes on wire (480 bits), 60 bytes captured (480 bits) on interface \Device\NPF_{286628B7-C690-4A38-B5BC-FA4478D21241}, id 0
Ethernet II, Src: Cisco_82:0b:84 (00:10:7b:82:0b:84), Dst: Cisco_82:0b:84 (00:10:7b:82:0b:84)
Configuration Test Protocol (loopback)
Data (40 bytes)

0000  00 00 00 00 00 00 00 00 00 00 00 00 00 00 00 00   ................
0010  00 00 00 00 00 00 00 00 00 00 00 00 00 00 00 00   ................
0020  00 00 00 00 00 00 00 00                           ........

No.     Time           Source                Destination           Protocol Length Info
      2 1.287693       30.30.30.1            30.30.30.6            TCP      66     51406 → 10000 [SYN] Seq=0 Win=64240 Len=0 MSS=1460 WS=256 SACK_PERM

Frame 2: 66 bytes on wire (528 bits), 66 bytes captured (528 bits) on interface \Device\NPF_{286628B7-C690-4A38-B5BC-FA4478D21241}, id 0
Ethernet II, Src: Cisco_82:0b:84 (00:10:7b:82:0b:84), Dst: RealtekS_68:23:8b (00:e0:4c:68:23:8b)
Internet Protocol Version 4, Src: 30.30.30.1, Dst: 30.30.30.6
    0100 .... = Version: 4
    .... 0101 = Header Length: 20 bytes (5)
    Differentiated Services Field: 0x00 (DSCP: CS0, ECN: Not-ECT)
    Total Length: 52
    Identification: 0x657b (25979)
    010. .... = Flags: 0x2, Don't fragment
        0... .... = Reserved bit: Not set
        .1.. .... = Don't fragment: Set
        ..0. .... = More fragments: Not set
    ...0 0000 0000 0000 = Fragment Offset: 0
    Time to Live: 127
    Protocol: TCP (6)
    Header Checksum: 0x1e06 [validation disabled]
    [Header checksum status: Unverified]
    Source Address: 30.30.30.1
    Destination Address: 30.30.30.6
Transmission Control Protocol, Src Port: 51406, Dst Port: 10000, Seq: 0, Len: 0
    Source Port: 51406
    Destination Port: 10000
    [Stream index: 0]
    [Conversation completeness: Complete, WITH_DATA (31)]
    [TCP Segment Len: 0]
    Sequence Number: 0    (relative sequence number)
    Sequence Number (raw): 286733386
    [Next Sequence Number: 1    (relative sequence number)]
    Acknowledgment Number: 0
    Acknowledgment number (raw): 0
    1000 .... = Header Length: 32 bytes (8)
    Flags: 0x002 (SYN)
    Window: 64240
    [Calculated window size: 64240]
    Checksum: 0xc69c [unverified]
    [Checksum Status: Unverified]
    Urgent Pointer: 0
    Options: (12 bytes), Maximum segment size, No-Operation (NOP), Window scale, No-Operation (NOP), No-Operation (NOP), SACK permitted
    [Timestamps]

No.     Time           Source                Destination           Protocol Length Info
      3 1.287965       30.30.30.6            30.30.30.1            TCP      66     10000 → 51406 [SYN, ACK] Seq=0 Ack=1 Win=65535 Len=0 MSS=1460 WS=256 SACK_PERM

Frame 3: 66 bytes on wire (528 bits), 66 bytes captured (528 bits) on interface \Device\NPF_{286628B7-C690-4A38-B5BC-FA4478D21241}, id 0
Ethernet II, Src: RealtekS_68:23:8b (00:e0:4c:68:23:8b), Dst: Cisco_82:0b:84 (00:10:7b:82:0b:84)
Internet Protocol Version 4, Src: 30.30.30.6, Dst: 30.30.30.1
    0100 .... = Version: 4
    .... 0101 = Header Length: 20 bytes (5)
    Differentiated Services Field: 0x00 (DSCP: CS0, ECN: Not-ECT)
    Total Length: 52
    Identification: 0xfba5 (64421)
    010. .... = Flags: 0x2, Don't fragment
        0... .... = Reserved bit: Not set
        .1.. .... = Don't fragment: Set
        ..0. .... = More fragments: Not set
    ...0 0000 0000 0000 = Fragment Offset: 0
    Time to Live: 128
    Protocol: TCP (6)
    Header Checksum: 0x0000 [validation disabled]
    [Header checksum status: Unverified]
    Source Address: 30.30.30.6
    Destination Address: 30.30.30.1
Transmission Control Protocol, Src Port: 10000, Dst Port: 51406, Seq: 0, Ack: 1, Len: 0
    Source Port: 10000
    Destination Port: 51406
    [Stream index: 0]
    [Conversation completeness: Complete, WITH_DATA (31)]
    [TCP Segment Len: 0]
    Sequence Number: 0    (relative sequence number)
    Sequence Number (raw): 790392274
    [Next Sequence Number: 1    (relative sequence number)]
    Acknowledgment Number: 1    (relative ack number)
    Acknowledgment number (raw): 286733387
    1000 .... = Header Length: 32 bytes (8)
    Flags: 0x012 (SYN, ACK)
    Window: 65535
    [Calculated window size: 65535]
    Checksum: 0x7869 [unverified]
    [Checksum Status: Unverified]
    Urgent Pointer: 0
    Options: (12 bytes), Maximum segment size, No-Operation (NOP), Window scale, No-Operation (NOP), No-Operation (NOP), SACK permitted
    [Timestamps]
    [SEQ/ACK analysis]

No.     Time           Source                Destination           Protocol Length Info
      4 1.290408       30.30.30.1            30.30.30.6            TCP      60     51406 → 10000 [ACK] Seq=1 Ack=1 Win=65536 Len=0

Frame 4: 60 bytes on wire (480 bits), 60 bytes captured (480 bits) on interface \Device\NPF_{286628B7-C690-4A38-B5BC-FA4478D21241}, id 0
Ethernet II, Src: Cisco_82:0b:84 (00:10:7b:82:0b:84), Dst: RealtekS_68:23:8b (00:e0:4c:68:23:8b)
Internet Protocol Version 4, Src: 30.30.30.1, Dst: 30.30.30.6
    0100 .... = Version: 4
    .... 0101 = Header Length: 20 bytes (5)
    Differentiated Services Field: 0x00 (DSCP: CS0, ECN: Not-ECT)
    Total Length: 40
    Identification: 0x657c (25980)
    010. .... = Flags: 0x2, Don't fragment
        0... .... = Reserved bit: Not set
        .1.. .... = Don't fragment: Set
        ..0. .... = More fragments: Not set
    ...0 0000 0000 0000 = Fragment Offset: 0
    Time to Live: 127
    Protocol: TCP (6)
    Header Checksum: 0x1e11 [validation disabled]
    [Header checksum status: Unverified]
    Source Address: 30.30.30.1
    Destination Address: 30.30.30.6
Transmission Control Protocol, Src Port: 51406, Dst Port: 10000, Seq: 1, Ack: 1, Len: 0
    Source Port: 51406
    Destination Port: 10000
    [Stream index: 0]
    [Conversation completeness: Complete, WITH_DATA (31)]
    [TCP Segment Len: 0]
    Sequence Number: 1    (relative sequence number)
    Sequence Number (raw): 286733387
    [Next Sequence Number: 1    (relative sequence number)]
    Acknowledgment Number: 1    (relative ack number)
    Acknowledgment number (raw): 790392275
    0101 .... = Header Length: 20 bytes (5)
    Flags: 0x010 (ACK)
    Window: 256
    [Calculated window size: 65536]
    [Window size scaling factor: 256]
    Checksum: 0x6461 [unverified]
    [Checksum Status: Unverified]
    Urgent Pointer: 0
    [Timestamps]
    [SEQ/ACK analysis]

No.     Time           Source                Destination           Protocol Length Info
      5 6.669179       30.30.30.6            30.30.30.7            BROWSER  243    Local Master Announcement NANDITO, Workstation, Server, NT Workstation, Potential Browser, Master Browser

Frame 5: 243 bytes on wire (1944 bits), 243 bytes captured (1944 bits) on interface \Device\NPF_{286628B7-C690-4A38-B5BC-FA4478D21241}, id 0
Ethernet II, Src: RealtekS_68:23:8b (00:e0:4c:68:23:8b), Dst: Broadcast (ff:ff:ff:ff:ff:ff)
Internet Protocol Version 4, Src: 30.30.30.6, Dst: 30.30.30.7
    0100 .... = Version: 4
    .... 0101 = Header Length: 20 bytes (5)
    Differentiated Services Field: 0x00 (DSCP: CS0, ECN: Not-ECT)
    Total Length: 229
    Identification: 0x0998 (2456)
    000. .... = Flags: 0x0
        0... .... = Reserved bit: Not set
        .0.. .... = Don't fragment: Not set
        ..0. .... = More fragments: Not set
    ...0 0000 0000 0000 = Fragment Offset: 0
    Time to Live: 128
    Protocol: UDP (17)
    Header Checksum: 0x0000 [validation disabled]
    [Header checksum status: Unverified]
    Source Address: 30.30.30.6
    Destination Address: 30.30.30.7
User Datagram Protocol, Src Port: 138, Dst Port: 138
NetBIOS Datagram Service
SMB (Server Message Block Protocol)
SMB MailSlot Protocol
Microsoft Windows Browser Protocol

No.     Time           Source                Destination           Protocol Length Info
      6 10.000234      Cisco_82:0b:84        Cisco_82:0b:84        LOOP     60     Reply

Frame 6: 60 bytes on wire (480 bits), 60 bytes captured (480 bits) on interface \Device\NPF_{286628B7-C690-4A38-B5BC-FA4478D21241}, id 0
Ethernet II, Src: Cisco_82:0b:84 (00:10:7b:82:0b:84), Dst: Cisco_82:0b:84 (00:10:7b:82:0b:84)
Configuration Test Protocol (loopback)
Data (40 bytes)

0000  00 00 00 00 00 00 00 00 00 00 00 00 00 00 00 00   ................
0010  00 00 00 00 00 00 00 00 00 00 00 00 00 00 00 00   ................
0020  00 00 00 00 00 00 00 00                           ........

No.     Time           Source                Destination           Protocol Length Info
      7 20.000051      Cisco_82:0b:84        Cisco_82:0b:84        LOOP     60     Reply

Frame 7: 60 bytes on wire (480 bits), 60 bytes captured (480 bits) on interface \Device\NPF_{286628B7-C690-4A38-B5BC-FA4478D21241}, id 0
Ethernet II, Src: Cisco_82:0b:84 (00:10:7b:82:0b:84), Dst: Cisco_82:0b:84 (00:10:7b:82:0b:84)
Configuration Test Protocol (loopback)
Data (40 bytes)

0000  00 00 00 00 00 00 00 00 00 00 00 00 00 00 00 00   ................
0010  00 00 00 00 00 00 00 00 00 00 00 00 00 00 00 00   ................
0020  00 00 00 00 00 00 00 00                           ........

No.     Time           Source                Destination           Protocol Length Info
      8 29.090597      30.30.30.1            30.30.30.6            TCP      60     51406 → 10000 [PSH, ACK] Seq=1 Ack=1 Win=65536 Len=3 [TCP segment of a reassembled PDU]

Frame 8: 60 bytes on wire (480 bits), 60 bytes captured (480 bits) on interface \Device\NPF_{286628B7-C690-4A38-B5BC-FA4478D21241}, id 0
Ethernet II, Src: Cisco_82:0b:84 (00:10:7b:82:0b:84), Dst: RealtekS_68:23:8b (00:e0:4c:68:23:8b)
Internet Protocol Version 4, Src: 30.30.30.1, Dst: 30.30.30.6
    0100 .... = Version: 4
    .... 0101 = Header Length: 20 bytes (5)
    Differentiated Services Field: 0x00 (DSCP: CS0, ECN: Not-ECT)
    Total Length: 43
    Identification: 0x657d (25981)
    010. .... = Flags: 0x2, Don't fragment
        0... .... = Reserved bit: Not set
        .1.. .... = Don't fragment: Set
        ..0. .... = More fragments: Not set
    ...0 0000 0000 0000 = Fragment Offset: 0
    Time to Live: 127
    Protocol: TCP (6)
    Header Checksum: 0x1e0d [validation disabled]
    [Header checksum status: Unverified]
    Source Address: 30.30.30.1
    Destination Address: 30.30.30.6
Transmission Control Protocol, Src Port: 51406, Dst Port: 10000, Seq: 1, Ack: 1, Len: 3
    Source Port: 51406
    Destination Port: 10000
    [Stream index: 0]
    [Conversation completeness: Complete, WITH_DATA (31)]
    [TCP Segment Len: 3]
    Sequence Number: 1    (relative sequence number)
    Sequence Number (raw): 286733387
    [Next Sequence Number: 4    (relative sequence number)]
    Acknowledgment Number: 1    (relative ack number)
    Acknowledgment number (raw): 790392275
    0101 .... = Header Length: 20 bytes (5)
    Flags: 0x018 (PSH, ACK)
    Window: 256
    [Calculated window size: 65536]
    [Window size scaling factor: 256]
    Checksum: 0xb3dc [unverified]
    [Checksum Status: Unverified]
    Urgent Pointer: 0
    [Timestamps]
    [SEQ/ACK analysis]
    TCP payload (3 bytes)
    TCP segment data (3 bytes)

No.     Time           Source                Destination           Protocol Length Info
      9 29.144792      30.30.30.6            30.30.30.1            TCP      54     10000 → 51406 [ACK] Seq=1 Ack=4 Win=525568 Len=0

Frame 9: 54 bytes on wire (432 bits), 54 bytes captured (432 bits) on interface \Device\NPF_{286628B7-C690-4A38-B5BC-FA4478D21241}, id 0
Ethernet II, Src: RealtekS_68:23:8b (00:e0:4c:68:23:8b), Dst: Cisco_82:0b:84 (00:10:7b:82:0b:84)
Internet Protocol Version 4, Src: 30.30.30.6, Dst: 30.30.30.1
    0100 .... = Version: 4
    .... 0101 = Header Length: 20 bytes (5)
    Differentiated Services Field: 0x00 (DSCP: CS0, ECN: Not-ECT)
    Total Length: 40
    Identification: 0xfba6 (64422)
    010. .... = Flags: 0x2, Don't fragment
        0... .... = Reserved bit: Not set
        .1.. .... = Don't fragment: Set
        ..0. .... = More fragments: Not set
    ...0 0000 0000 0000 = Fragment Offset: 0
    Time to Live: 128
    Protocol: TCP (6)
    Header Checksum: 0x0000 [validation disabled]
    [Header checksum status: Unverified]
    Source Address: 30.30.30.6
    Destination Address: 30.30.30.1
Transmission Control Protocol, Src Port: 10000, Dst Port: 51406, Seq: 1, Ack: 4, Len: 0
    Source Port: 10000
    Destination Port: 51406
    [Stream index: 0]
    [Conversation completeness: Complete, WITH_DATA (31)]
    [TCP Segment Len: 0]
    Sequence Number: 1    (relative sequence number)
    Sequence Number (raw): 790392275
    [Next Sequence Number: 1    (relative sequence number)]
    Acknowledgment Number: 4    (relative ack number)
    Acknowledgment number (raw): 286733390
    0101 .... = Header Length: 20 bytes (5)
    Flags: 0x010 (ACK)
    Window: 2053
    [Calculated window size: 525568]
    [Window size scaling factor: 256]
    Checksum: 0x785d [unverified]
    [Checksum Status: Unverified]
    Urgent Pointer: 0
    [Timestamps]
    [SEQ/ACK analysis]

No.     Time           Source                Destination           Protocol Length Info
     10 30.000596      Cisco_82:0b:84        Cisco_82:0b:84        LOOP     60     Reply

Frame 10: 60 bytes on wire (480 bits), 60 bytes captured (480 bits) on interface \Device\NPF_{286628B7-C690-4A38-B5BC-FA4478D21241}, id 0
Ethernet II, Src: Cisco_82:0b:84 (00:10:7b:82:0b:84), Dst: Cisco_82:0b:84 (00:10:7b:82:0b:84)
Configuration Test Protocol (loopback)
Data (40 bytes)

0000  00 00 00 00 00 00 00 00 00 00 00 00 00 00 00 00   ................
0010  00 00 00 00 00 00 00 00 00 00 00 00 00 00 00 00   ................
0020  00 00 00 00 00 00 00 00                           ........

No.     Time           Source                Destination           Protocol Length Info
     11 31.172394      Cisco_82:0b:84        CDP/VTP/DTP/PAgP/UDLD CDP      365    Device ID: Router  Port ID: Ethernet0  

Frame 11: 365 bytes on wire (2920 bits), 365 bytes captured (2920 bits) on interface \Device\NPF_{286628B7-C690-4A38-B5BC-FA4478D21241}, id 0
IEEE 802.3 Ethernet 
Logical-Link Control
Cisco Discovery Protocol

No.     Time           Source                Destination           Protocol Length Info
     12 40.000319      Cisco_82:0b:84        Cisco_82:0b:84        LOOP     60     Reply

Frame 12: 60 bytes on wire (480 bits), 60 bytes captured (480 bits) on interface \Device\NPF_{286628B7-C690-4A38-B5BC-FA4478D21241}, id 0
Ethernet II, Src: Cisco_82:0b:84 (00:10:7b:82:0b:84), Dst: Cisco_82:0b:84 (00:10:7b:82:0b:84)
Configuration Test Protocol (loopback)
Data (40 bytes)

0000  00 00 00 00 00 00 00 00 00 00 00 00 00 00 00 00   ................
0010  00 00 00 00 00 00 00 00 00 00 00 00 00 00 00 00   ................
0020  00 00 00 00 00 00 00 00                           ........

No.     Time           Source                Destination           Protocol Length Info
     13 49.561810      30.30.30.6            30.30.30.1            TCP      57     10000 → 51406 [PSH, ACK] Seq=1 Ack=4 Win=525568 Len=3 [TCP segment of a reassembled PDU]

Frame 13: 57 bytes on wire (456 bits), 57 bytes captured (456 bits) on interface \Device\NPF_{286628B7-C690-4A38-B5BC-FA4478D21241}, id 0
Ethernet II, Src: RealtekS_68:23:8b (00:e0:4c:68:23:8b), Dst: Cisco_82:0b:84 (00:10:7b:82:0b:84)
Internet Protocol Version 4, Src: 30.30.30.6, Dst: 30.30.30.1
    0100 .... = Version: 4
    .... 0101 = Header Length: 20 bytes (5)
    Differentiated Services Field: 0x00 (DSCP: CS0, ECN: Not-ECT)
    Total Length: 43
    Identification: 0xfba7 (64423)
    010. .... = Flags: 0x2, Don't fragment
        0... .... = Reserved bit: Not set
        .1.. .... = Don't fragment: Set
        ..0. .... = More fragments: Not set
    ...0 0000 0000 0000 = Fragment Offset: 0
    Time to Live: 128
    Protocol: TCP (6)
    Header Checksum: 0x0000 [validation disabled]
    [Header checksum status: Unverified]
    Source Address: 30.30.30.6
    Destination Address: 30.30.30.1
Transmission Control Protocol, Src Port: 10000, Dst Port: 51406, Seq: 1, Ack: 4, Len: 3
    Source Port: 10000
    Destination Port: 51406
    [Stream index: 0]
    [Conversation completeness: Complete, WITH_DATA (31)]
    [TCP Segment Len: 3]
    Sequence Number: 1    (relative sequence number)
    Sequence Number (raw): 790392275
    [Next Sequence Number: 4    (relative sequence number)]
    Acknowledgment Number: 4    (relative ack number)
    Acknowledgment number (raw): 286733390
    0101 .... = Header Length: 20 bytes (5)
    Flags: 0x018 (PSH, ACK)
    Window: 2053
    [Calculated window size: 525568]
    [Window size scaling factor: 256]
    Checksum: 0x7860 [unverified]
    [Checksum Status: Unverified]
    Urgent Pointer: 0
    [Timestamps]
    [SEQ/ACK analysis]
    TCP payload (3 bytes)
    TCP segment data (3 bytes)

No.     Time           Source                Destination           Protocol Length Info
     14 49.561996      30.30.30.6            30.30.30.1            TCP      54     10000 → 51406 [FIN, ACK] Seq=4 Ack=4 Win=525568 Len=0

Frame 14: 54 bytes on wire (432 bits), 54 bytes captured (432 bits) on interface \Device\NPF_{286628B7-C690-4A38-B5BC-FA4478D21241}, id 0
Ethernet II, Src: RealtekS_68:23:8b (00:e0:4c:68:23:8b), Dst: Cisco_82:0b:84 (00:10:7b:82:0b:84)
Internet Protocol Version 4, Src: 30.30.30.6, Dst: 30.30.30.1
    0100 .... = Version: 4
    .... 0101 = Header Length: 20 bytes (5)
    Differentiated Services Field: 0x00 (DSCP: CS0, ECN: Not-ECT)
    Total Length: 40
    Identification: 0xfba8 (64424)
    010. .... = Flags: 0x2, Don't fragment
        0... .... = Reserved bit: Not set
        .1.. .... = Don't fragment: Set
        ..0. .... = More fragments: Not set
    ...0 0000 0000 0000 = Fragment Offset: 0
    Time to Live: 128
    Protocol: TCP (6)
    Header Checksum: 0x0000 [validation disabled]
    [Header checksum status: Unverified]
    Source Address: 30.30.30.6
    Destination Address: 30.30.30.1
Transmission Control Protocol, Src Port: 10000, Dst Port: 51406, Seq: 4, Ack: 4, Len: 0
    Source Port: 10000
    Destination Port: 51406
    [Stream index: 0]
    [Conversation completeness: Complete, WITH_DATA (31)]
    [TCP Segment Len: 0]
    Sequence Number: 4    (relative sequence number)
    Sequence Number (raw): 790392278
    [Next Sequence Number: 5    (relative sequence number)]
    Acknowledgment Number: 4    (relative ack number)
    Acknowledgment number (raw): 286733390
    0101 .... = Header Length: 20 bytes (5)
    Flags: 0x011 (FIN, ACK)
    Window: 2053
    [Calculated window size: 525568]
    [Window size scaling factor: 256]
    Checksum: 0x785d [unverified]
    [Checksum Status: Unverified]
    Urgent Pointer: 0
    [Timestamps]

No.     Time           Source                Destination           Protocol Length Info
     15 49.564208      30.30.30.1            30.30.30.6            TCP      60     51406 → 10000 [ACK] Seq=4 Ack=5 Win=65536 Len=0

Frame 15: 60 bytes on wire (480 bits), 60 bytes captured (480 bits) on interface \Device\NPF_{286628B7-C690-4A38-B5BC-FA4478D21241}, id 0
Ethernet II, Src: Cisco_82:0b:84 (00:10:7b:82:0b:84), Dst: RealtekS_68:23:8b (00:e0:4c:68:23:8b)
Internet Protocol Version 4, Src: 30.30.30.1, Dst: 30.30.30.6
    0100 .... = Version: 4
    .... 0101 = Header Length: 20 bytes (5)
    Differentiated Services Field: 0x00 (DSCP: CS0, ECN: Not-ECT)
    Total Length: 40
    Identification: 0x657e (25982)
    010. .... = Flags: 0x2, Don't fragment
        0... .... = Reserved bit: Not set
        .1.. .... = Don't fragment: Set
        ..0. .... = More fragments: Not set
    ...0 0000 0000 0000 = Fragment Offset: 0
    Time to Live: 127
    Protocol: TCP (6)
    Header Checksum: 0x1e0f [validation disabled]
    [Header checksum status: Unverified]
    Source Address: 30.30.30.1
    Destination Address: 30.30.30.6
Transmission Control Protocol, Src Port: 51406, Dst Port: 10000, Seq: 4, Ack: 5, Len: 0
    Source Port: 51406
    Destination Port: 10000
    [Stream index: 0]
    [Conversation completeness: Complete, WITH_DATA (31)]
    [TCP Segment Len: 0]
    Sequence Number: 4    (relative sequence number)
    Sequence Number (raw): 286733390
    [Next Sequence Number: 4    (relative sequence number)]
    Acknowledgment Number: 5    (relative ack number)
    Acknowledgment number (raw): 790392279
    0101 .... = Header Length: 20 bytes (5)
    Flags: 0x010 (ACK)
    Window: 256
    [Calculated window size: 65536]
    [Window size scaling factor: 256]
    Checksum: 0x645a [unverified]
    [Checksum Status: Unverified]
    Urgent Pointer: 0
    [Timestamps]
    [SEQ/ACK analysis]

No.     Time           Source                Destination           Protocol Length Info
     16 49.565415      30.30.30.1            30.30.30.6            TCP      60     51406 → 10000 [FIN, ACK] Seq=4 Ack=5 Win=65536 Len=0

Frame 16: 60 bytes on wire (480 bits), 60 bytes captured (480 bits) on interface \Device\NPF_{286628B7-C690-4A38-B5BC-FA4478D21241}, id 0
Ethernet II, Src: Cisco_82:0b:84 (00:10:7b:82:0b:84), Dst: RealtekS_68:23:8b (00:e0:4c:68:23:8b)
Internet Protocol Version 4, Src: 30.30.30.1, Dst: 30.30.30.6
    0100 .... = Version: 4
    .... 0101 = Header Length: 20 bytes (5)
    Differentiated Services Field: 0x00 (DSCP: CS0, ECN: Not-ECT)
    Total Length: 40
    Identification: 0x657f (25983)
    010. .... = Flags: 0x2, Don't fragment
        0... .... = Reserved bit: Not set
        .1.. .... = Don't fragment: Set
        ..0. .... = More fragments: Not set
    ...0 0000 0000 0000 = Fragment Offset: 0
    Time to Live: 127
    Protocol: TCP (6)
    Header Checksum: 0x1e0e [validation disabled]
    [Header checksum status: Unverified]
    Source Address: 30.30.30.1
    Destination Address: 30.30.30.6
Transmission Control Protocol, Src Port: 51406, Dst Port: 10000, Seq: 4, Ack: 5, Len: 0
    Source Port: 51406
    Destination Port: 10000
    [Stream index: 0]
    [Conversation completeness: Complete, WITH_DATA (31)]
    [TCP Segment Len: 0]
    Sequence Number: 4    (relative sequence number)
    Sequence Number (raw): 286733390
    [Next Sequence Number: 5    (relative sequence number)]
    Acknowledgment Number: 5    (relative ack number)
    Acknowledgment number (raw): 790392279
    0101 .... = Header Length: 20 bytes (5)
    Flags: 0x011 (FIN, ACK)
    Window: 256
    [Calculated window size: 65536]
    [Window size scaling factor: 256]
    Checksum: 0x6459 [unverified]
    [Checksum Status: Unverified]
    Urgent Pointer: 0
    [Timestamps]

No.     Time           Source                Destination           Protocol Length Info
     17 49.565467      30.30.30.6            30.30.30.1            TCP      54     10000 → 51406 [ACK] Seq=5 Ack=5 Win=525568 Len=0

Frame 17: 54 bytes on wire (432 bits), 54 bytes captured (432 bits) on interface \Device\NPF_{286628B7-C690-4A38-B5BC-FA4478D21241}, id 0
Ethernet II, Src: RealtekS_68:23:8b (00:e0:4c:68:23:8b), Dst: Cisco_82:0b:84 (00:10:7b:82:0b:84)
Internet Protocol Version 4, Src: 30.30.30.6, Dst: 30.30.30.1
    0100 .... = Version: 4
    .... 0101 = Header Length: 20 bytes (5)
    Differentiated Services Field: 0x00 (DSCP: CS0, ECN: Not-ECT)
    Total Length: 40
    Identification: 0xfba9 (64425)
    010. .... = Flags: 0x2, Don't fragment
        0... .... = Reserved bit: Not set
        .1.. .... = Don't fragment: Set
        ..0. .... = More fragments: Not set
    ...0 0000 0000 0000 = Fragment Offset: 0
    Time to Live: 128
    Protocol: TCP (6)
    Header Checksum: 0x0000 [validation disabled]
    [Header checksum status: Unverified]
    Source Address: 30.30.30.6
    Destination Address: 30.30.30.1
Transmission Control Protocol, Src Port: 10000, Dst Port: 51406, Seq: 5, Ack: 5, Len: 0
    Source Port: 10000
    Destination Port: 51406
    [Stream index: 0]
    [Conversation completeness: Complete, WITH_DATA (31)]
    [TCP Segment Len: 0]
    Sequence Number: 5    (relative sequence number)
    Sequence Number (raw): 790392279
    [Next Sequence Number: 5    (relative sequence number)]
    Acknowledgment Number: 5    (relative ack number)
    Acknowledgment number (raw): 286733391
    0101 .... = Header Length: 20 bytes (5)
    Flags: 0x010 (ACK)
    Window: 2053
    [Calculated window size: 525568]
    [Window size scaling factor: 256]
    Checksum: 0x785d [unverified]
    [Checksum Status: Unverified]
    Urgent Pointer: 0
    [Timestamps]
    [SEQ/ACK analysis]

No.     Time           Source                Destination           Protocol Length Info
     18 50.000709      Cisco_82:0b:84        Cisco_82:0b:84        LOOP     60     Reply

Frame 18: 60 bytes on wire (480 bits), 60 bytes captured (480 bits) on interface \Device\NPF_{286628B7-C690-4A38-B5BC-FA4478D21241}, id 0
Ethernet II, Src: Cisco_82:0b:84 (00:10:7b:82:0b:84), Dst: Cisco_82:0b:84 (00:10:7b:82:0b:84)
Configuration Test Protocol (loopback)
Data (40 bytes)

0000  00 00 00 00 00 00 00 00 00 00 00 00 00 00 00 00   ................
0010  00 00 00 00 00 00 00 00 00 00 00 00 00 00 00 00   ................
0020  00 00 00 00 00 00 00 00                           ........

No.     Time           Source                Destination           Protocol Length Info
     19 56.674339      30.30.30.1            30.30.30.6            TCP      66     51420 → 10000 [SYN] Seq=0 Win=64240 Len=0 MSS=1460 WS=256 SACK_PERM

Frame 19: 66 bytes on wire (528 bits), 66 bytes captured (528 bits) on interface \Device\NPF_{286628B7-C690-4A38-B5BC-FA4478D21241}, id 0
Ethernet II, Src: Cisco_82:0b:84 (00:10:7b:82:0b:84), Dst: RealtekS_68:23:8b (00:e0:4c:68:23:8b)
Internet Protocol Version 4, Src: 30.30.30.1, Dst: 30.30.30.6
    0100 .... = Version: 4
    .... 0101 = Header Length: 20 bytes (5)
    Differentiated Services Field: 0x00 (DSCP: CS0, ECN: Not-ECT)
    Total Length: 52
    Identification: 0x6580 (25984)
    010. .... = Flags: 0x2, Don't fragment
        0... .... = Reserved bit: Not set
        .1.. .... = Don't fragment: Set
        ..0. .... = More fragments: Not set
    ...0 0000 0000 0000 = Fragment Offset: 0
    Time to Live: 127
    Protocol: TCP (6)
    Header Checksum: 0x1e01 [validation disabled]
    [Header checksum status: Unverified]
    Source Address: 30.30.30.1
    Destination Address: 30.30.30.6
Transmission Control Protocol, Src Port: 51420, Dst Port: 10000, Seq: 0, Len: 0
    Source Port: 51420
    Destination Port: 10000
    [Stream index: 1]
    [Conversation completeness: Complete, WITH_DATA (31)]
    [TCP Segment Len: 0]
    Sequence Number: 0    (relative sequence number)
    Sequence Number (raw): 98810993
    [Next Sequence Number: 1    (relative sequence number)]
    Acknowledgment Number: 0
    Acknowledgment number (raw): 0
    1000 .... = Header Length: 32 bytes (8)
    Flags: 0x002 (SYN)
    Window: 64240
    [Calculated window size: 64240]
    Checksum: 0x499b [unverified]
    [Checksum Status: Unverified]
    Urgent Pointer: 0
    Options: (12 bytes), Maximum segment size, No-Operation (NOP), Window scale, No-Operation (NOP), No-Operation (NOP), SACK permitted
    [Timestamps]

No.     Time           Source                Destination           Protocol Length Info
     20 56.674673      30.30.30.6            30.30.30.1            TCP      66     10000 → 51420 [SYN, ACK] Seq=0 Ack=1 Win=65535 Len=0 MSS=1460 WS=256 SACK_PERM

Frame 20: 66 bytes on wire (528 bits), 66 bytes captured (528 bits) on interface \Device\NPF_{286628B7-C690-4A38-B5BC-FA4478D21241}, id 0
Ethernet II, Src: RealtekS_68:23:8b (00:e0:4c:68:23:8b), Dst: Cisco_82:0b:84 (00:10:7b:82:0b:84)
Internet Protocol Version 4, Src: 30.30.30.6, Dst: 30.30.30.1
    0100 .... = Version: 4
    .... 0101 = Header Length: 20 bytes (5)
    Differentiated Services Field: 0x00 (DSCP: CS0, ECN: Not-ECT)
    Total Length: 52
    Identification: 0xfbaa (64426)
    010. .... = Flags: 0x2, Don't fragment
        0... .... = Reserved bit: Not set
        .1.. .... = Don't fragment: Set
        ..0. .... = More fragments: Not set
    ...0 0000 0000 0000 = Fragment Offset: 0
    Time to Live: 128
    Protocol: TCP (6)
    Header Checksum: 0x0000 [validation disabled]
    [Header checksum status: Unverified]
    Source Address: 30.30.30.6
    Destination Address: 30.30.30.1
Transmission Control Protocol, Src Port: 10000, Dst Port: 51420, Seq: 0, Ack: 1, Len: 0
    Source Port: 10000
    Destination Port: 51420
    [Stream index: 1]
    [Conversation completeness: Complete, WITH_DATA (31)]
    [TCP Segment Len: 0]
    Sequence Number: 0    (relative sequence number)
    Sequence Number (raw): 2900877856
    [Next Sequence Number: 1    (relative sequence number)]
    Acknowledgment Number: 1    (relative ack number)
    Acknowledgment number (raw): 98810994
    1000 .... = Header Length: 32 bytes (8)
    Flags: 0x012 (SYN, ACK)
    Window: 65535
    [Calculated window size: 65535]
    Checksum: 0x7869 [unverified]
    [Checksum Status: Unverified]
    Urgent Pointer: 0
    Options: (12 bytes), Maximum segment size, No-Operation (NOP), Window scale, No-Operation (NOP), No-Operation (NOP), SACK permitted
    [Timestamps]
    [SEQ/ACK analysis]

No.     Time           Source                Destination           Protocol Length Info
     21 56.677285      30.30.30.1            30.30.30.6            TCP      60     51420 → 10000 [ACK] Seq=1 Ack=1 Win=65536 Len=0

Frame 21: 60 bytes on wire (480 bits), 60 bytes captured (480 bits) on interface \Device\NPF_{286628B7-C690-4A38-B5BC-FA4478D21241}, id 0
Ethernet II, Src: Cisco_82:0b:84 (00:10:7b:82:0b:84), Dst: RealtekS_68:23:8b (00:e0:4c:68:23:8b)
Internet Protocol Version 4, Src: 30.30.30.1, Dst: 30.30.30.6
    0100 .... = Version: 4
    .... 0101 = Header Length: 20 bytes (5)
    Differentiated Services Field: 0x00 (DSCP: CS0, ECN: Not-ECT)
    Total Length: 40
    Identification: 0x6581 (25985)
    010. .... = Flags: 0x2, Don't fragment
        0... .... = Reserved bit: Not set
        .1.. .... = Don't fragment: Set
        ..0. .... = More fragments: Not set
    ...0 0000 0000 0000 = Fragment Offset: 0
    Time to Live: 127
    Protocol: TCP (6)
    Header Checksum: 0x1e0c [validation disabled]
    [Header checksum status: Unverified]
    Source Address: 30.30.30.1
    Destination Address: 30.30.30.6
Transmission Control Protocol, Src Port: 51420, Dst Port: 10000, Seq: 1, Ack: 1, Len: 0
    Source Port: 51420
    Destination Port: 10000
    [Stream index: 1]
    [Conversation completeness: Complete, WITH_DATA (31)]
    [TCP Segment Len: 0]
    Sequence Number: 1    (relative sequence number)
    Sequence Number (raw): 98810994
    [Next Sequence Number: 1    (relative sequence number)]
    Acknowledgment Number: 1    (relative ack number)
    Acknowledgment number (raw): 2900877857
    0101 .... = Header Length: 20 bytes (5)
    Flags: 0x010 (ACK)
    Window: 256
    [Calculated window size: 65536]
    [Window size scaling factor: 256]
    Checksum: 0xf545 [unverified]
    [Checksum Status: Unverified]
    Urgent Pointer: 0
    [Timestamps]
    [SEQ/ACK analysis]

No.     Time           Source                Destination           Protocol Length Info
     22 60.000443      Cisco_82:0b:84        Cisco_82:0b:84        LOOP     60     Reply

Frame 22: 60 bytes on wire (480 bits), 60 bytes captured (480 bits) on interface \Device\NPF_{286628B7-C690-4A38-B5BC-FA4478D21241}, id 0
Ethernet II, Src: Cisco_82:0b:84 (00:10:7b:82:0b:84), Dst: Cisco_82:0b:84 (00:10:7b:82:0b:84)
Configuration Test Protocol (loopback)
Data (40 bytes)

0000  00 00 00 00 00 00 00 00 00 00 00 00 00 00 00 00   ................
0010  00 00 00 00 00 00 00 00 00 00 00 00 00 00 00 00   ................
0020  00 00 00 00 00 00 00 00                           ........

No.     Time           Source                Destination           Protocol Length Info
     23 68.557635      30.30.30.1            30.30.30.6            TCP      62     51420 → 10000 [PSH, ACK] Seq=1 Ack=1 Win=65536 Len=8

Frame 23: 62 bytes on wire (496 bits), 62 bytes captured (496 bits) on interface \Device\NPF_{286628B7-C690-4A38-B5BC-FA4478D21241}, id 0
Ethernet II, Src: Cisco_82:0b:84 (00:10:7b:82:0b:84), Dst: RealtekS_68:23:8b (00:e0:4c:68:23:8b)
Internet Protocol Version 4, Src: 30.30.30.1, Dst: 30.30.30.6
    0100 .... = Version: 4
    .... 0101 = Header Length: 20 bytes (5)
    Differentiated Services Field: 0x00 (DSCP: CS0, ECN: Not-ECT)
    Total Length: 48
    Identification: 0x6582 (25986)
    010. .... = Flags: 0x2, Don't fragment
        0... .... = Reserved bit: Not set
        .1.. .... = Don't fragment: Set
        ..0. .... = More fragments: Not set
    ...0 0000 0000 0000 = Fragment Offset: 0
    Time to Live: 127
    Protocol: TCP (6)
    Header Checksum: 0x1e03 [validation disabled]
    [Header checksum status: Unverified]
    Source Address: 30.30.30.1
    Destination Address: 30.30.30.6
Transmission Control Protocol, Src Port: 51420, Dst Port: 10000, Seq: 1, Ack: 1, Len: 8
    Source Port: 51420
    Destination Port: 10000
    [Stream index: 1]
    [Conversation completeness: Complete, WITH_DATA (31)]
    [TCP Segment Len: 8]
    Sequence Number: 1    (relative sequence number)
    Sequence Number (raw): 98810994
    [Next Sequence Number: 9    (relative sequence number)]
    Acknowledgment Number: 1    (relative ack number)
    Acknowledgment number (raw): 2900877857
    0101 .... = Header Length: 20 bytes (5)
    Flags: 0x018 (PSH, ACK)
    Window: 256
    [Calculated window size: 65536]
    [Window size scaling factor: 256]
    Checksum: 0x1925 [unverified]
    [Checksum Status: Unverified]
    Urgent Pointer: 0
    [Timestamps]
    [SEQ/ACK analysis]
    TCP payload (8 bytes)
Data (8 bytes)

0000  45 53 45 54 20 34 31 35                           ESET 415

No.     Time           Source                Destination           Protocol Length Info
     24 68.607083      30.30.30.6            30.30.30.1            TCP      54     10000 → 51420 [ACK] Seq=1 Ack=9 Win=525568 Len=0

Frame 24: 54 bytes on wire (432 bits), 54 bytes captured (432 bits) on interface \Device\NPF_{286628B7-C690-4A38-B5BC-FA4478D21241}, id 0
Ethernet II, Src: RealtekS_68:23:8b (00:e0:4c:68:23:8b), Dst: Cisco_82:0b:84 (00:10:7b:82:0b:84)
Internet Protocol Version 4, Src: 30.30.30.6, Dst: 30.30.30.1
    0100 .... = Version: 4
    .... 0101 = Header Length: 20 bytes (5)
    Differentiated Services Field: 0x00 (DSCP: CS0, ECN: Not-ECT)
    Total Length: 40
    Identification: 0xfbab (64427)
    010. .... = Flags: 0x2, Don't fragment
        0... .... = Reserved bit: Not set
        .1.. .... = Don't fragment: Set
        ..0. .... = More fragments: Not set
    ...0 0000 0000 0000 = Fragment Offset: 0
    Time to Live: 128
    Protocol: TCP (6)
    Header Checksum: 0x0000 [validation disabled]
    [Header checksum status: Unverified]
    Source Address: 30.30.30.6
    Destination Address: 30.30.30.1
Transmission Control Protocol, Src Port: 10000, Dst Port: 51420, Seq: 1, Ack: 9, Len: 0
    Source Port: 10000
    Destination Port: 51420
    [Stream index: 1]
    [Conversation completeness: Complete, WITH_DATA (31)]
    [TCP Segment Len: 0]
    Sequence Number: 1    (relative sequence number)
    Sequence Number (raw): 2900877857
    [Next Sequence Number: 1    (relative sequence number)]
    Acknowledgment Number: 9    (relative ack number)
    Acknowledgment number (raw): 98811002
    0101 .... = Header Length: 20 bytes (5)
    Flags: 0x010 (ACK)
    Window: 2053
    [Calculated window size: 525568]
    [Window size scaling factor: 256]
    Checksum: 0x785d [unverified]
    [Checksum Status: Unverified]
    Urgent Pointer: 0
    [Timestamps]
    [SEQ/ACK analysis]

No.     Time           Source                Destination           Protocol Length Info
     25 70.000837      Cisco_82:0b:84        Cisco_82:0b:84        LOOP     60     Reply

Frame 25: 60 bytes on wire (480 bits), 60 bytes captured (480 bits) on interface \Device\NPF_{286628B7-C690-4A38-B5BC-FA4478D21241}, id 0
Ethernet II, Src: Cisco_82:0b:84 (00:10:7b:82:0b:84), Dst: Cisco_82:0b:84 (00:10:7b:82:0b:84)
Configuration Test Protocol (loopback)
Data (40 bytes)

0000  00 00 00 00 00 00 00 00 00 00 00 00 00 00 00 00   ................
0010  00 00 00 00 00 00 00 00 00 00 00 00 00 00 00 00   ................
0020  00 00 00 00 00 00 00 00                           ........

No.     Time           Source                Destination           Protocol Length Info
     26 74.141213      30.30.30.6            30.30.30.1            TCP      57     10000 → 51420 [PSH, ACK] Seq=1 Ack=9 Win=525568 Len=3 [TCP segment of a reassembled PDU]

Frame 26: 57 bytes on wire (456 bits), 57 bytes captured (456 bits) on interface \Device\NPF_{286628B7-C690-4A38-B5BC-FA4478D21241}, id 0
Ethernet II, Src: RealtekS_68:23:8b (00:e0:4c:68:23:8b), Dst: Cisco_82:0b:84 (00:10:7b:82:0b:84)
Internet Protocol Version 4, Src: 30.30.30.6, Dst: 30.30.30.1
    0100 .... = Version: 4
    .... 0101 = Header Length: 20 bytes (5)
    Differentiated Services Field: 0x00 (DSCP: CS0, ECN: Not-ECT)
    Total Length: 43
    Identification: 0xfbac (64428)
    010. .... = Flags: 0x2, Don't fragment
        0... .... = Reserved bit: Not set
        .1.. .... = Don't fragment: Set
        ..0. .... = More fragments: Not set
    ...0 0000 0000 0000 = Fragment Offset: 0
    Time to Live: 128
    Protocol: TCP (6)
    Header Checksum: 0x0000 [validation disabled]
    [Header checksum status: Unverified]
    Source Address: 30.30.30.6
    Destination Address: 30.30.30.1
Transmission Control Protocol, Src Port: 10000, Dst Port: 51420, Seq: 1, Ack: 9, Len: 3
    Source Port: 10000
    Destination Port: 51420
    [Stream index: 1]
    [Conversation completeness: Complete, WITH_DATA (31)]
    [TCP Segment Len: 3]
    Sequence Number: 1    (relative sequence number)
    Sequence Number (raw): 2900877857
    [Next Sequence Number: 4    (relative sequence number)]
    Acknowledgment Number: 9    (relative ack number)
    Acknowledgment number (raw): 98811002
    0101 .... = Header Length: 20 bytes (5)
    Flags: 0x018 (PSH, ACK)
    Window: 2053
    [Calculated window size: 525568]
    [Window size scaling factor: 256]
    Checksum: 0x7860 [unverified]
    [Checksum Status: Unverified]
    Urgent Pointer: 0
    [Timestamps]
    [SEQ/ACK analysis]
    TCP payload (3 bytes)
    TCP segment data (3 bytes)

No.     Time           Source                Destination           Protocol Length Info
     27 74.141323      30.30.30.6            30.30.30.1            TCP      54     10000 → 51420 [FIN, ACK] Seq=4 Ack=9 Win=525568 Len=0

Frame 27: 54 bytes on wire (432 bits), 54 bytes captured (432 bits) on interface \Device\NPF_{286628B7-C690-4A38-B5BC-FA4478D21241}, id 0
Ethernet II, Src: RealtekS_68:23:8b (00:e0:4c:68:23:8b), Dst: Cisco_82:0b:84 (00:10:7b:82:0b:84)
Internet Protocol Version 4, Src: 30.30.30.6, Dst: 30.30.30.1
    0100 .... = Version: 4
    .... 0101 = Header Length: 20 bytes (5)
    Differentiated Services Field: 0x00 (DSCP: CS0, ECN: Not-ECT)
    Total Length: 40
    Identification: 0xfbad (64429)
    010. .... = Flags: 0x2, Don't fragment
        0... .... = Reserved bit: Not set
        .1.. .... = Don't fragment: Set
        ..0. .... = More fragments: Not set
    ...0 0000 0000 0000 = Fragment Offset: 0
    Time to Live: 128
    Protocol: TCP (6)
    Header Checksum: 0x0000 [validation disabled]
    [Header checksum status: Unverified]
    Source Address: 30.30.30.6
    Destination Address: 30.30.30.1
Transmission Control Protocol, Src Port: 10000, Dst Port: 51420, Seq: 4, Ack: 9, Len: 0
    Source Port: 10000
    Destination Port: 51420
    [Stream index: 1]
    [Conversation completeness: Complete, WITH_DATA (31)]
    [TCP Segment Len: 0]
    Sequence Number: 4    (relative sequence number)
    Sequence Number (raw): 2900877860
    [Next Sequence Number: 5    (relative sequence number)]
